{
  "schema_version": 1,
  "session_id": "2026-09-01T1216Z-upload-acceptance-and-spend-preflight",
  "project": "classmind",
  "state": "pending",
  "state_set_at": "2026-09-01T13:40:00Z",
  "state_set_by": "End-Session (hand-authored retroactive capture)",
  "review": {
    "reviewed_at": null,
    "reviewed_by": null,
    "candidate_outcomes": [],
    "notes": ""
  }
}
