{
  "schema_version": 1,
  "session_id": "2026-08-30T1108Z-transcript-guard-and-mvp-sprint",
  "project": "classmind",
  "state": "pending",
  "state_set_at": "2026-08-30T11:08:26Z",
  "state_set_by": "End-Session (hand-authored)",
  "review": {
    "reviewed_at": null,
    "reviewed_by": null,
    "candidate_outcomes": [],
    "notes": ""
  }
}
