{
  "schema_version": 1,
  "session_id": "2026-08-30T2157Z-design-master-loop-observatory",
  "project": "classmind",
  "state": "pending",
  "state_set_at": "2026-08-30T21:57:00Z",
  "state_set_by": "End-Session (hand-authored)",
  "review": {
    "reviewed_at": null,
    "reviewed_by": null,
    "candidate_outcomes": [],
    "notes": ""
  }
}
