{
  "schema_version": 1,
  "session_id": "2026-09-07T0300Z-security-audit-and-hardening",
  "project": "classmind",
  "state": "pending",
  "state_set_at": "2026-09-07T03:00:00Z",
  "state_set_by": "End-Session (hand-authored)",
  "review": {
    "reviewed_at": null,
    "reviewed_by": null,
    "candidate_outcomes": [],
    "notes": ""
  }
}
