{
  "schema_version": 1,
  "session_id": "2026-09-01T1758Z-recovery-closure-and-ledger-check",
  "project": "classmind",
  "state": "pending",
  "state_set_at": "2026-09-01T17:58:00Z",
  "state_set_by": "End-Session (hand-authored)",
  "review": {
    "reviewed_at": null,
    "reviewed_by": null,
    "candidate_outcomes": [],
    "notes": ""
  }
}
